{
  "$schema": "https://json-schema.org/draft/2020-12/schema",
  "$id": "workpacks/WORKPACK_OUTPUT_SCHEMA.json",
  "title": "Workpack Agent Handoff Output",
  "description": "Structured handoff produced by each agent after completing a prompt. Required for Workpack Protocol v2+. Extended in v6 with workpack.meta.json cross-references.",
  "type": "object",
  "required": [
    "schema_version",
    "workpack",
    "prompt",
    "component",
    "delivery_mode",
    "branch",
    "changes",
    "verification",
    "handoff"
  ],
  "properties": {
    "schema_version": {
      "type": "string",
      "description": "Schema version for this output payload.",
      "pattern": "^1\\.[0-9]+$",
      "examples": ["1.1"]
    },
    "workpack": {
      "type": "string",
      "description": "Workpack folder name (must match workpack.meta.json id).",
      "minLength": 5
    },
    "prompt": {
      "type": "string",
      "description": "Prompt basename without extension (e.g., A1_protocol_spec).",
      "minLength": 3
    },
    "component": {
      "type": "string",
      "description": "Affected component or domain."
    },
    "delivery_mode": {
      "type": "string",
      "enum": ["pr", "direct_push"]
    },
    "branch": {
      "type": "object",
      "required": ["base", "work", "merge_target"],
      "properties": {
        "base": { "type": "string" },
        "work": { "type": "string" },
        "merge_target": { "type": "string" }
      },
      "additionalProperties": false
    },
    "artifacts": {
      "type": "object",
      "properties": {
        "pr_url": { "type": "string" },
        "commit_shas": { "type": "array", "items": { "type": "string" } }
      },
      "additionalProperties": true
    },
    "changes": {
      "type": "object",
      "required": ["files_modified", "files_created", "contracts_changed", "breaking_change"],
      "properties": {
        "files_modified": { "type": "array", "items": { "type": "string" } },
        "files_created": { "type": "array", "items": { "type": "string" } },
        "contracts_changed": { "type": "array", "items": { "type": "string" } },
        "breaking_change": { "type": "boolean" }
      },
      "additionalProperties": true
    },
    "verification": {
      "type": "object",
      "required": ["commands"],
      "properties": {
        "commands": {
          "type": "array",
          "items": {
            "type": "object",
            "required": ["cmd", "result"],
            "properties": {
              "cmd": { "type": "string" },
              "result": { "type": "string", "enum": ["pass", "fail", "not_run"] },
              "notes": { "type": "string" }
            },
            "additionalProperties": false
          }
        },
        "regression_added": { "type": "boolean" },
        "regression_notes": { "type": "string" }
      },
      "additionalProperties": true
    },
    "handoff": {
      "type": "object",
      "required": ["summary", "next_steps", "known_issues"],
      "properties": {
        "summary": { "type": "string" },
        "next_steps": { "type": "array", "items": { "type": "string" } },
        "known_issues": { "type": "array", "items": { "type": "string" } }
      },
      "additionalProperties": true
    },
    "repos": {
      "type": "array",
      "items": { "type": "string" },
      "description": "Repositories touched by this prompt."
    },
    "execution": {
      "type": "object",
      "description": "Cost and execution metrics.",
      "properties": {
        "model": { "type": "string" },
        "tokens_in": { "type": "integer", "minimum": 0 },
        "tokens_out": { "type": "integer", "minimum": 0 },
        "duration_ms": { "type": "integer", "minimum": 0 }
      },
      "additionalProperties": true
    },
    "severity": {
      "type": ["string", "null"],
      "enum": ["blocker", "major", "minor", null]
    },
    "iteration": { "type": "integer", "minimum": 1 },
    "b_series_resolved": { "type": "array", "items": { "type": "string" } },
    "b_series_remaining": { "type": "array", "items": { "type": "string" } },
    "b_series_budget_warning": { "type": "boolean", "default": false },
    "change_details": {
      "type": "array",
      "items": {
        "type": "object",
        "properties": {
          "repo": { "type": "string" },
          "file": { "type": "string" },
          "action": { "type": "string", "enum": ["created", "modified", "deleted", "renamed"] },
          "lines_added": { "type": "integer", "minimum": 0 },
          "lines_removed": { "type": "integer", "minimum": 0 }
        },
        "required": ["repo", "file", "action"]
      }
    },
    "notes": { "type": "string" }
  },
  "additionalProperties": true
}
