{
  "schema_version": "1.2",
  "workpack": "02_workpack-protocol_verification-hardening",
  "prompt": "A3_output_artifact_checks",
  "component": "verification-tooling",
  "delivery_mode": "pr",
  "branch": {
    "base": "main",
    "work": "feature/verification-hardening",
    "merge_target": "main"
  },
  "artifacts": {
    "pr_url": "",
    "commit_shas": [
      "2cc2a50394dd1ceebabccd6816e630d1bbb6fe8c"
    ],
    "branch_verified": false
  },
  "changes": {
    "files_modified": [],
    "files_created": [
      "workpacks/tools/verify_output_artifacts.py",
      "workpacks/tools/tests/test_verify_output_artifacts.py",
      "workpacks/instances/workpack-protocol/02_workpack-protocol_verification-hardening/outputs/A3_output_artifact_checks.json"
    ],
    "contracts_changed": [],
    "breaking_change": false
  },
  "verification": {
    "commands": [
      {
        "cmd": "python -m pytest workpacks/tools/tests/test_verify_output_artifacts.py -v",
        "result": "pass",
        "notes": "All output artifact tests passing."
      },
      {
        "cmd": "python workpacks/tools/verify_output_artifacts.py",
        "result": "fail",
        "notes": "Repo-wide scan reports pre-existing issues in other workpacks. Target workpack outputs validate correctly."
      },
      {
        "cmd": "python -m pytest workpacks/tools/tests/ -v",
        "result": "pass",
        "notes": "184 passed."
      }
    ],
    "regression_added": true,
    "regression_notes": "Added unit tests for output JSON existence for complete prompts (AC6), schema conformance validation, and declared file existence checks (AC7)."
  },
  "handoff": {
    "summary": "Implemented output artifact checker: validates outputs/*.json existence for every complete prompt, validates each against WORKPACK_OUTPUT_SCHEMA.json, and verifies files declared in changes.files_created and changes.files_modified exist on disk. Backfilled output during V1 remediation.",
    "next_steps": [
      "Wire into unified verify command via A7"
    ],
    "known_issues": [
      "Repo-wide scan reports pre-existing declared-file-missing errors in other workpacks outside this prompt scope."
    ]
  },
  "repos": [
    "WorkpackManager"
  ],
  "execution": {
    "model": "claude-opus-4-20250514",
    "tokens_in": 0,
    "tokens_out": 0,
    "duration_ms": 0
  },
  "change_details": [
    {
      "repo": "WorkpackManager",
      "file": "workpacks/tools/verify_output_artifacts.py",
      "action": "created"
    },
    {
      "repo": "WorkpackManager",
      "file": "workpacks/tools/tests/test_verify_output_artifacts.py",
      "action": "created"
    },
    {
      "repo": "WorkpackManager",
      "file": "workpacks/instances/workpack-protocol/02_workpack-protocol_verification-hardening/outputs/A3_output_artifact_checks.json",
      "action": "created"
    }
  ],
  "notes": "Output backfilled during V1 remediation. Tool was implemented and tests pass but prompt output was not originally recorded. Covers AC6 (output existence) and AC7 (declared file existence)."
}
