{
  "schema_version": "1.2",
  "workpack": "04_workpack-protocol_npm-distribution",
  "prompt": "A3_init_command",
  "component": "init-cli",
  "delivery_mode": "pr",
  "branch": {
    "base": "main",
    "work": "feature/npm-distribution",
    "merge_target": "main"
  },
  "artifacts": {
    "pr_url": "",
    "commit_shas": [
      "570c08d"
    ],
    "branch_verified": false
  },
  "changes": {
    "files_modified": [
      "packages/protocol/bin/init.js",
      "workpacks/instances/workpack-protocol/04_workpack-protocol_npm-distribution/99_status.md",
      "workpacks/instances/workpack-protocol/04_workpack-protocol_npm-distribution/workpack.state.json"
    ],
    "files_created": [
      "packages/protocol/tests/test-init.js",
      "workpacks/instances/workpack-protocol/04_workpack-protocol_npm-distribution/outputs/A3_init_command.json"
    ],
    "contracts_changed": [],
    "breaking_change": false
  },
  "verification": {
    "commands": [
      {
        "cmd": "node packages/protocol/tests/test-init.js",
        "result": "pass",
        "notes": "Integration test validates default init, --dir, and --protocol-version behavior in temp directories."
      },
      {
        "cmd": "node packages/protocol/bin/init.js --help",
        "result": "pass",
        "notes": "Help output printed usage and options."
      }
    ],
    "regression_added": true,
    "regression_notes": "Added packages/protocol/tests/test-init.js to cover init command asset bootstrap behavior."
  },
  "handoff": {
    "summary": "Init CLI command implemented with --dir and --protocol-version flags, recursive asset copy, config generation, and integration test coverage.",
    "next_steps": [
      "Proceed to V1_integration_meta"
    ],
    "known_issues": []
  },
  "repos": [
    "WorkpackManager"
  ],
  "execution": {
    "model": "gpt-5-codex",
    "tokens_in": 0,
    "tokens_out": 0,
    "duration_ms": 0
  },
  "change_details": [
    {
      "repo": "WorkpackManager",
      "file": "packages/protocol/bin/init.js",
      "action": "modified"
    },
    {
      "repo": "WorkpackManager",
      "file": "packages/protocol/tests/test-init.js",
      "action": "created"
    },
    {
      "repo": "WorkpackManager",
      "file": "workpacks/instances/workpack-protocol/04_workpack-protocol_npm-distribution/99_status.md",
      "action": "modified"
    },
    {
      "repo": "WorkpackManager",
      "file": "workpacks/instances/workpack-protocol/04_workpack-protocol_npm-distribution/workpack.state.json",
      "action": "modified"
    },
    {
      "repo": "WorkpackManager",
      "file": "workpacks/instances/workpack-protocol/04_workpack-protocol_npm-distribution/outputs/A3_init_command.json",
      "action": "created"
    }
  ],
  "notes": ""
}
