{
  "schema_version": "1.2",
  "workpack": "03_workpack-manager-v2_marketplace-publishing",
  "prompt": "A1_vsix_packaging",
  "component": "extension-packaging",
  "delivery_mode": "pr",
  "branch": {
    "base": "master",
    "work": "feature/marketplace-publishing",
    "merge_target": "master"
  },
  "artifacts": {
    "pr_url": "",
    "commit_shas": [
      "dff99fe25a387f5cd7449a5b60491ccc71b7b6f6"
    ],
    "branch_verified": false
  },
  "changes": {
    "files_modified": [
      ".vscodeignore",
      "package-lock.json",
      "package.json"
    ],
    "files_created": [
      "resources/icon.png"
    ],
    "contracts_changed": [],
    "breaking_change": false
  },
  "verification": {
    "commands": [
      {
        "cmd": "npm run build",
        "result": "pass",
        "notes": "TypeScript build succeeded."
      },
      {
        "cmd": "npm run package:vsix",
        "result": "pass",
        "notes": "VSIX generated successfully as workpack-manager-0.0.1.vsix."
      },
      {
        "cmd": "npm run package:vsix:list",
        "result": "pass",
        "notes": "Packaged contents exclude src/, tests/, coverage/, and workpacks/."
      }
    ],
    "regression_added": false,
    "regression_notes": ""
  },
  "handoff": {
    "summary": "Configured VSIX packaging and marketplace metadata, added extension icon, and verified VSIX packaging.",
    "next_steps": [
      "Execute A2_npm_publish_protocol for npm publication readiness.",
      "Wire release automation in A3_ci_release_pipeline."
    ],
    "known_issues": [
      "Cross-workpack dependency 02_workpack-manager-v2_test-coverage-hardening is still in_progress."
    ]
  },
  "repos": [
    "WorkpackManager"
  ],
  "execution": {
    "model": "gpt-5-codex",
    "tokens_in": 0,
    "tokens_out": 0,
    "duration_ms": 0
  },
  "change_details": [
    {
      "repo": "WorkpackManager",
      "file": ".vscodeignore",
      "action": "created"
    },
    {
      "repo": "WorkpackManager",
      "file": "package-lock.json",
      "action": "modified"
    },
    {
      "repo": "WorkpackManager",
      "file": "package.json",
      "action": "modified"
    },
    {
      "repo": "WorkpackManager",
      "file": "resources/icon.png",
      "action": "created"
    }
  ],
  "notes": "Only A1-scoped files were committed; unrelated packages/protocol edits remained untouched."
}
